{
  "$schema": "../schema/gig.schema.json",
  "slug": "david-kayode-goods-shed-2026",
  "title": "David Kayode",
  "date": "2026-07-03",
  "venue": {
    "name": "Goods Shed",
    "location": "Stroud, UK",
    "links": [
      { "label": "Website", "url": "https://www.sva.org.uk/goods-shed-sessions" },
      { "label": "Facebook", "url": "https://www.facebook.com/thegoodsshedstroud/" }
    ]
  },
  "artists": [
    {
      "name": "David Kayode",
      "links": [
        { "label": "Instagram", "url": "https://www.instagram.com/d.kayode/" },
        { "label": "Bandcamp", "url": "https://davidkayode.bandcamp.com/" }
      ]
    }
  ],
  "permission": "display-only",
  "description": "",
  "cover": "P1000063.jpg",
  "layout": { "columns": 3, "widths": [1, 1.07, 1] },
  "images": [
    { "file": "P1000075.jpg", "width": 2435, "height": 4288, "column": 0 },
    { "file": "P1000063.jpg", "width": 4989, "height": 2770, "column": 1 },
    { "file": "P1000072.jpg", "width": 6007, "height": 3468, "column": 1 },
    { "file": "P1000076.jpg", "width": 5475, "height": 2694, "column": 1 },
    { "file": "P1000099.jpg", "width": 2446, "height": 4186, "column": 2 }
  ]
}
